{"$schema":"https://json-schema.org/draft/2020-12/schema","type":"object","additionalProperties":false,"required":["schema_version","status","decision_date","approval_source","authority_role","languages","source_snapshots","scope","license_evidence","study_conditions","community_use_interpretation","freeze_effect","supersedes_pending_packets","does_not_supersede","promotion_allowed","empirical_execution_authorized","remaining_blocker"],"properties":{"schema_version":{"const":"spanish-japanese-use-approval-v1"},"status":{"const":"approved_for_frozen_internal_study_scope"},"decision_date":{"const":"2026-08-12"},"approval_source":{"type":"string","minLength":1},"authority_role":{"type":"string","minLength":1},"languages":{"const":["es","ja"]},"source_snapshots":{"const":["hpo-translation-es-repository-snapshot","hpo-translation-ja-repository-snapshot"]},"scope":{"type":"string","minLength":1},"license_evidence":{"type":"object"},"study_conditions":{"type":"array","minItems":7,"uniqueItems":true,"items":{"type":"string"}},"community_use_interpretation":{"type":"string"},"freeze_effect":{"const":"post_freeze_gate_receipt_does_not_modify_frozen_components"},"supersedes_pending_packets":{"const":["g2-spanish-language","g2-japanese-language"]},"does_not_supersede":{"const":["g2-ethics-privacy","g2-community-slot"]},"promotion_allowed":{"const":false},"empirical_execution_authorized":{"const":false},"remaining_blocker":{"const":"ethics_privacy_determination"}}}
